<?xml version="1.0" encoding="UTF-8"?>
<!ELEMENT fabricantes  (#PCDATA)>
<!ELEMENT fabricante  (#PCDATA)>
<!ATTLIST fabricante codigo ID #REQUIRED>
<!ATTLIST fabricante nombre CDATA #REQUIRED>
